web-scraper-order,web-scraper-start-url,category,category-href,sub-category,sub-category-href,product-link,product-link-href,name,price,description,img-src
1720548795-124,https://www.nike.com/ca/men,Just Released,https://www.nike.com/ca/w/new-mens-3n82yznik1,Shorts,https://www.nike.com/ca/w/new-mens-shorts-38fphz3n82yznik1,"<img alt=""Jordan Flight Men&#x27;s Fleece Diamond Shorts"" class=""product-card__hero-image css-1fxh5tw"" height=""400"" loading=""lazy"" width=""400""/>",https://www.nike.com/ca/t/jordan-flight-fleece-diamond-shorts-bwPF9C/FV7257-091,Jordan Flight,$90,"Your wardrobe must-have is back and cosier than ever. Smooth on the outside and brushed soft on the inside, these heavyweight fleece shorts are the perfect way to add a little warmth to your day. A classic fit gives them just the right amount of room to help you move freely on and off the court.","https://static.nike.com/a/images/t_PDP_1728_v1/f_auto,q_auto:eco,u_126ab356-44d8-4a06-89b4-fcdcc8df0245,c_scale,fl_relative,w_1.0,h_1.0,fl_layer_apply/8ace3452-9e83-478e-91bb-48eb9759910b/jordan-flight-fleece-diamond-shorts-bwPF9C.png"
1720548796-124,https://www.nike.com/ca/men,Just Released,https://www.nike.com/ca/w/new-mens-3n82yznik1,Shorts,https://www.nike.com/ca/w/new-mens-shorts-38fphz3n82yznik1,"<img alt=""Jordan Flight Men&#x27;s Fleece Diamond Shorts"" class=""product-card__hero-image css-1fxh5tw"" height=""400"" loading=""lazy"" width=""400""/>",https://www.nike.com/ca/t/jordan-flight-fleece-diamond-shorts-bwPF9C/FV7257-091,Jordan Flight,$90,"Your wardrobe must-have is back and cosier than ever. Smooth on the outside and brushed soft on the inside, these heavyweight fleece shorts are the perfect way to add a little warmth to your day. A classic fit gives them just the right amount of room to help you move freely on and off the court.","https://static.nike.com/a/images/t_PDP_1728_v1/f_auto,q_auto:eco,u_126ab356-44d8-4a06-89b4-fcdcc8df0245,c_scale,fl_relative,w_1.0,h_1.0,fl_layer_apply/8ace3452-9e83-478e-91bb-48eb9759910b/jordan-flight-fleece-diamond-shorts-bwPF9C.png"
1720548799-125,https://www.nike.com/ca/men,Just Released,https://www.nike.com/ca/w/new-mens-3n82yznik1,Shorts,https://www.nike.com/ca/w/new-mens-shorts-38fphz3n82yznik1,"<img alt=""Nike Stride Men&#x27;s Dri-FIT 13cm (approx.)Hybrid Running Shorts"" class=""product-card__hero-image css-1fxh5tw"" height=""400"" loading=""lazy"" width=""400""/>",https://www.nike.com/ca/t/stride-dri-fit-13cm-hybrid-running-shorts-C023lg/DM4757-464,Nike Stride,$80,"Designed for running, the Stride Shorts have a lightweight feel—made from at least 75% recycled polyester fibres—and are made for unrestricted movement. They're smooth to the touch, with extra breathability on the upper back. Plus, they feature a full-length internal shorts liner for extra coverage and support. Need to take a phone along? We've got a pocket at the back geared just for your device.","https://static.nike.com/a/images/t_PDP_1728_v1/f_auto,q_auto:eco/b1fcdcc8-c714-4f25-bea6-16c404fd7754/stride-dri-fit-13cm-hybrid-running-shorts-C023lg.png"
1720548802-126,https://www.nike.com/ca/men,Just Released,https://www.nike.com/ca/w/new-mens-3n82yznik1,Shorts,https://www.nike.com/ca/w/new-mens-shorts-38fphz3n82yznik1,"<img alt=""Nike DNA Men&#x27;s 15cm (approx.) Dri-FIT Basketball Shorts"" class=""product-card__hero-image css-1fxh5tw"" height=""400"" loading=""lazy"" width=""400""/>",https://www.nike.com/ca/t/dna-15cm-dri-fit-basketball-shorts-pqLTcg/FZ0685-100,Nike DNA,$75,"Designed with a classic fit, these 15cm (approx.) basketball shorts are made from sweat-wicking mesh material to help keep you cool and dry. Their scoreboard-inspired print pairs with the striped tape accents to create a vintage basketball vibe.","https://static.nike.com/a/images/t_PDP_1728_v1/f_auto,q_auto:eco/4c946c66-d02a-44b6-9dae-d7a62aab59fa/dna-15cm-dri-fit-basketball-shorts-pqLTcg.png"
1720548807-127,https://www.nike.com/ca/men,Just Released,https://www.nike.com/ca/w/new-mens-3n82yznik1,Tops & T-Shirts,https://www.nike.com/ca/w/new-mens-tops-t-shirts-3n82yz9om13znik1,"<img alt=""NikeCourt Dri-FIT Men&#x27;s Tennis Polo"" class=""product-card__hero-image css-1fxh5tw"" height=""400"" loading=""lazy"" width=""400""/>",https://www.nike.com/ca/t/nikecourt-dri-fit-tennis-polo-m273Rj/DH0857-370,NikeCourt Dri-FIT,$64,"Made from soft knit fabric that's made from 100% recycled polyester fibres, the NikeCourt Dri-FIT Polo is a classic-looking, sweat-wicking court staple.","https://static.nike.com/a/images/t_PDP_1728_v1/f_auto,q_auto:eco/577c4310-ca4a-4066-9574-8ce2284fc638/nikecourt-dri-fit-tennis-polo-m273Rj.png"
1720548808-127,https://www.nike.com/ca/men,Just Released,https://www.nike.com/ca/w/new-mens-3n82yznik1,Tops & T-Shirts,https://www.nike.com/ca/w/new-mens-tops-t-shirts-3n82yz9om13znik1,"<img alt=""NikeCourt Dri-FIT Men&#x27;s Tennis Polo"" class=""product-card__hero-image css-1fxh5tw"" height=""400"" loading=""lazy"" width=""400""/>",https://www.nike.com/ca/t/nikecourt-dri-fit-tennis-polo-m273Rj/DH0857-370,NikeCourt Dri-FIT,$64,"Made from soft knit fabric that's made from 100% recycled polyester fibres, the NikeCourt Dri-FIT Polo is a classic-looking, sweat-wicking court staple.","https://static.nike.com/a/images/t_PDP_1728_v1/f_auto,q_auto:eco/577c4310-ca4a-4066-9574-8ce2284fc638/nikecourt-dri-fit-tennis-polo-m273Rj.png"
1720548810-128,https://www.nike.com/ca/men,Just Released,https://www.nike.com/ca/w/new-mens-3n82yznik1,Tops & T-Shirts,https://www.nike.com/ca/w/new-mens-tops-t-shirts-3n82yz9om13znik1,"<img alt=""Nike Victory+ Men&#x27;s Golf Polo"" class=""product-card__hero-image css-1fxh5tw"" height=""400"" loading=""lazy"" width=""400""/>",https://www.nike.com/ca/t/victory-golf-polo-3J3L8Q/FQ1134-410,Nike Victory+,$80,"This Victory+ polo has a classic fit with smooth, sweat-wicking fabric to help you stay dry and focused on your game. Graphics are inspired by the wire grass, pine needles and pine cones lining the fairways.","https://static.nike.com/a/images/t_PDP_1728_v1/f_auto,q_auto:eco/3a48d1b2-e00b-4c8e-ae1f-7e41561046ff/victory-golf-polo-3J3L8Q.png"
1720548811-128,https://www.nike.com/ca/men,Just Released,https://www.nike.com/ca/w/new-mens-3n82yznik1,Tops & T-Shirts,https://www.nike.com/ca/w/new-mens-tops-t-shirts-3n82yz9om13znik1,"<img alt=""Nike Victory+ Men&#x27;s Golf Polo"" class=""product-card__hero-image css-1fxh5tw"" height=""400"" loading=""lazy"" width=""400""/>",https://www.nike.com/ca/t/victory-golf-polo-3J3L8Q/FQ1134-410,Nike Victory+,$80,"This Victory+ polo has a classic fit with smooth, sweat-wicking fabric to help you stay dry and focused on your game. Graphics are inspired by the wire grass, pine needles and pine cones lining the fairways.","https://static.nike.com/a/images/t_PDP_1728_v1/f_auto,q_auto:eco/3a48d1b2-e00b-4c8e-ae1f-7e41561046ff/victory-golf-polo-3J3L8Q.png"
1720548813-129,https://www.nike.com/ca/men,Just Released,https://www.nike.com/ca/w/new-mens-3n82yznik1,Tops & T-Shirts,https://www.nike.com/ca/w/new-mens-tops-t-shirts-3n82yz9om13znik1,"<img alt=""Nike Sportswear Men&#x27;s Max90 T-Shirt"" class=""product-card__hero-image css-1fxh5tw"" height=""400"" loading=""lazy"" width=""400""/>",https://www.nike.com/ca/t/sportswear-max90-t-shirt-2t9V1q/HJ6897-801,Nike Sportswear,$55,Hit the streets in this soft midweight cotton tee that's heavy on the vintage vibes. It's designed to feel roomy through the chest and body for easy movement and layering.,"https://static.nike.com/a/images/t_PDP_1728_v1/f_auto,q_auto:eco/a250c84b-4ec7-445e-a43c-04f00ad6ab69/sportswear-max90-t-shirt-2t9V1q.png"
1720548815-130,https://www.nike.com/ca/men,Just Released,https://www.nike.com/ca/w/new-mens-3n82yznik1,Tops & T-Shirts,https://www.nike.com/ca/w/new-mens-tops-t-shirts-3n82yz9om13znik1,"<img alt=""Nike Club Men&#x27;s Crew-Neck Jumper"" class=""product-card__hero-image css-1fxh5tw"" height=""400"" loading=""lazy"" width=""400""/>",https://www.nike.com/ca/t/club-crew-neck-jumper-JLFlK8/FQ2912-663,Nike Club,$110,"This classic knit jumper offers a clean look and comfortable feel for cool-weather days. The relaxed fit gives you a bit of room to layer, and the crew-neck design lets it be paired it up with just about anything.","https://static.nike.com/a/images/t_PDP_1728_v1/f_auto,q_auto:eco/ad311881-d940-4e81-a9c7-ed8e0c794532/club-crew-neck-jumper-JLFlK8.png"
1720548816-130,https://www.nike.com/ca/men,Just Released,https://www.nike.com/ca/w/new-mens-3n82yznik1,Tops & T-Shirts,https://www.nike.com/ca/w/new-mens-tops-t-shirts-3n82yz9om13znik1,"<img alt=""Nike Club Men&#x27;s Crew-Neck Jumper"" class=""product-card__hero-image css-1fxh5tw"" height=""400"" loading=""lazy"" width=""400""/>",https://www.nike.com/ca/t/club-crew-neck-jumper-JLFlK8/FQ2912-663,Nike Club,$110,"This classic knit jumper offers a clean look and comfortable feel for cool-weather days. The relaxed fit gives you a bit of room to layer, and the crew-neck design lets it be paired it up with just about anything.","https://static.nike.com/a/images/t_PDP_1728_v1/f_auto,q_auto:eco/ad311881-d940-4e81-a9c7-ed8e0c794532/club-crew-neck-jumper-JLFlK8.png"
1720548818-131,https://www.nike.com/ca/men,Just Released,https://www.nike.com/ca/w/new-mens-3n82yznik1,Tops & T-Shirts,https://www.nike.com/ca/w/new-mens-tops-t-shirts-3n82yz9om13znik1,"<img alt=""Nike Tech Men&#x27;s Short-Sleeve Fleece Top"" class=""product-card__hero-image css-1fxh5tw"" height=""400"" loading=""lazy"" width=""400""/>",https://www.nike.com/ca/t/tech-short-sleeve-fleece-top-ZNzvZC/FZ7581-010,Nike Tech,$120,"This spacious top is built from our premium, lightweight fleece—smooth both inside and out—to give you plenty of warmth without adding bulk. The oversized look fits slightly longer with plenty of space through the body.","https://static.nike.com/a/images/t_PDP_1728_v1/f_auto,q_auto:eco/73b5a138-0874-47a8-9fee-fa2d2e75136b/tech-short-sleeve-fleece-top-ZNzvZC.png"
1720548821-132,https://www.nike.com/ca/men,Just Released,https://www.nike.com/ca/w/new-mens-3n82yznik1,Tops & T-Shirts,https://www.nike.com/ca/w/new-mens-tops-t-shirts-3n82yz9om13znik1,"<img alt=""Nike Running Division Men&#x27;s Dri-FIT ADV Short-Sleeve Running Top"" class=""product-card__hero-image css-1fxh5tw"" height=""400"" loading=""lazy"" width=""400""/>",https://www.nike.com/ca/t/running-division-dri-fit-adv-short-sleeve-running-top-F2jv6t/FZ0583-072,Nike Running Division,$100,"Day or night, rain or shine, Nike Running Division offers the features you need to navigate the concrete, cars and crossings of the paved landscape. This Dri-FIT ADV top uses breathable, sweat-wicking fabric to help you stay cool and comfortable through every run.","https://static.nike.com/a/images/t_PDP_1728_v1/f_auto,q_auto:eco/44587b80-0f80-4986-9334-368092228a33/running-division-dri-fit-adv-short-sleeve-running-top-F2jv6t.png"
1720548822-132,https://www.nike.com/ca/men,Just Released,https://www.nike.com/ca/w/new-mens-3n82yznik1,Tops & T-Shirts,https://www.nike.com/ca/w/new-mens-tops-t-shirts-3n82yz9om13znik1,"<img alt=""Nike Running Division Men&#x27;s Dri-FIT ADV Short-Sleeve Running Top"" class=""product-card__hero-image css-1fxh5tw"" height=""400"" loading=""lazy"" width=""400""/>",https://www.nike.com/ca/t/running-division-dri-fit-adv-short-sleeve-running-top-F2jv6t/FZ0583-072,Nike Running Division,$100,"Day or night, rain or shine, Nike Running Division offers the features you need to navigate the concrete, cars and crossings of the paved landscape. This Dri-FIT ADV top uses breathable, sweat-wicking fabric to help you stay cool and comfortable through every run.","https://static.nike.com/a/images/t_PDP_1728_v1/f_auto,q_auto:eco/44587b80-0f80-4986-9334-368092228a33/running-division-dri-fit-adv-short-sleeve-running-top-F2jv6t.png"
1720548824-133,https://www.nike.com/ca/men,Just Released,https://www.nike.com/ca/w/new-mens-3n82yznik1,Tops & T-Shirts,https://www.nike.com/ca/w/new-mens-tops-t-shirts-3n82yz9om13znik1,"<img alt=""Nike Sportswear Men&#x27;s Baseball Jersey"" class=""product-card__hero-image css-1fxh5tw"" height=""400"" loading=""lazy"" width=""400""/>",https://www.nike.com/ca/t/sportswear-baseball-jersey-dg5RQM/HJ9001-020,Nike Sportswear,$100,"This soft cotton jersey combines an athletic aesthetic with beach vibes for a look you can wear beyond game day. Featuring buttons, embroidered details and felt patches, it brings surf style to a classic baseball silhouette.","https://static.nike.com/a/images/t_PDP_1728_v1/f_auto,q_auto:eco/c50c07f6-4508-413a-be61-9685b1a0b817/sportswear-baseball-jersey-dg5RQM.png"
1720548826-134,https://www.nike.com/ca/men,Just Released,https://www.nike.com/ca/w/new-mens-3n82yznik1,Tops & T-Shirts,https://www.nike.com/ca/w/new-mens-tops-t-shirts-3n82yz9om13znik1,"<img alt=""Nike Sportswear Men&#x27;s Max90 T-Shirt"" class=""product-card__hero-image css-1fxh5tw"" height=""400"" loading=""lazy"" width=""400""/>",https://www.nike.com/ca/t/sportswear-max90-t-shirt-b510m9/FZ5385-010,Nike Sportswear,$55,"This Max90 tee offers dropped shoulders, longer sleeves and a roomy fit through the body and hips, giving it a relaxed look. Midweight cotton fabric feels soft and has a slight drape.","https://static.nike.com/a/images/t_PDP_1728_v1/f_auto,q_auto:eco/ead63166-52e5-47b4-90a0-91b7c6610dd7/sportswear-max90-t-shirt-b510m9.png"
1720548827-134,https://www.nike.com/ca/men,Just Released,https://www.nike.com/ca/w/new-mens-3n82yznik1,Tops & T-Shirts,https://www.nike.com/ca/w/new-mens-tops-t-shirts-3n82yz9om13znik1,"<img alt=""Nike Sportswear Men&#x27;s Max90 T-Shirt"" class=""product-card__hero-image css-1fxh5tw"" height=""400"" loading=""lazy"" width=""400""/>",https://www.nike.com/ca/t/sportswear-max90-t-shirt-b510m9/FZ5385-010,Nike Sportswear,$55,"This Max90 tee offers dropped shoulders, longer sleeves and a roomy fit through the body and hips, giving it a relaxed look. Midweight cotton fabric feels soft and has a slight drape.","https://static.nike.com/a/images/t_PDP_1728_v1/f_auto,q_auto:eco/ead63166-52e5-47b4-90a0-91b7c6610dd7/sportswear-max90-t-shirt-b510m9.png"
1720548829-135,https://www.nike.com/ca/men,Just Released,https://www.nike.com/ca/w/new-mens-3n82yznik1,Tops & T-Shirts,https://www.nike.com/ca/w/new-mens-tops-t-shirts-3n82yz9om13znik1,"<img alt=""Nike Men&#x27;s Max90 Basketball T-Shirt"" class=""product-card__hero-image css-1fxh5tw"" height=""400"" loading=""lazy"" width=""400""/>",https://www.nike.com/ca/t/max90-basketball-t-shirt-GfB08g/FZ8083-100,Nike,$64,"This Max90 tee has dropped shoulders, longer sleeves and a roomy fit for easy-going comfort. Its midweight fabric feels soft and slightly smooth.","https://static.nike.com/a/images/t_PDP_1728_v1/f_auto,q_auto:eco/49fbbd3f-fe0e-4f98-a9be-22cf7d6e2835/max90-basketball-t-shirt-GfB08g.png"
1720548832-136,https://www.nike.com/ca/men,Just Released,https://www.nike.com/ca/w/new-mens-3n82yznik1,Tops & T-Shirts,https://www.nike.com/ca/w/new-mens-tops-t-shirts-3n82yz9om13znik1,"<img alt=""Jordan Flight Essentials Men&#x27;s T-Shirt"" class=""product-card__hero-image css-1fxh5tw"" height=""400"" loading=""lazy"" width=""400""/>",https://www.nike.com/ca/t/jordan-flight-essentials-t-shirt-w7Wrq8/FZ1967-687,Jordan Flight Essentials,$50,"Let 'em know you're skyborne. Midweight cotton gives this classic tee a soft feel and slight drape, making it ideal for everyday wear.","https://static.nike.com/a/images/t_PDP_1728_v1/f_auto,q_auto:eco,u_126ab356-44d8-4a06-89b4-fcdcc8df0245,c_scale,fl_relative,w_1.0,h_1.0,fl_layer_apply/a39f8dee-be4d-4c1c-827f-d41808a6309c/jordan-flight-essentials-t-shirt-w7Wrq8.png"
1720548834-137,https://www.nike.com/ca/men,Just Released,https://www.nike.com/ca/w/new-mens-3n82yznik1,Tops & T-Shirts,https://www.nike.com/ca/w/new-mens-tops-t-shirts-3n82yz9om13znik1,"<img alt=""Jordan Flight Essentials 85 Men&#x27;s Washed T-Shirt"" class=""product-card__hero-image css-1fxh5tw"" height=""400"" loading=""lazy"" width=""400""/>",https://www.nike.com/ca/t/jordan-flight-essentials-85-washed-t-shirt-PdjT7C/FZ1914-228,Jordan Flight Essentials 85,$64,"Looking for a tee with a little extra something? We've got you. Heavyweight cotton gives this easy-fitting top a stiff drape and structured feel, while a special wash treatment mimics the natural fading of denim for added swag.","https://static.nike.com/a/images/t_PDP_1728_v1/f_auto,q_auto:eco,u_126ab356-44d8-4a06-89b4-fcdcc8df0245,c_scale,fl_relative,w_1.0,h_1.0,fl_layer_apply/cf1cee8b-da14-42a6-8e4a-24bb45e72256/jordan-flight-essentials-85-washed-t-shirt-PdjT7C.png"
1720548835-137,https://www.nike.com/ca/men,Just Released,https://www.nike.com/ca/w/new-mens-3n82yznik1,Tops & T-Shirts,https://www.nike.com/ca/w/new-mens-tops-t-shirts-3n82yz9om13znik1,"<img alt=""Jordan Flight Essentials 85 Men&#x27;s Washed T-Shirt"" class=""product-card__hero-image css-1fxh5tw"" height=""400"" loading=""lazy"" width=""400""/>",https://www.nike.com/ca/t/jordan-flight-essentials-85-washed-t-shirt-PdjT7C/FZ1914-228,Jordan Flight Essentials 85,$64,"Looking for a tee with a little extra something? We've got you. Heavyweight cotton gives this easy-fitting top a stiff drape and structured feel, while a special wash treatment mimics the natural fading of denim for added swag.","https://static.nike.com/a/images/t_PDP_1728_v1/f_auto,q_auto:eco,u_126ab356-44d8-4a06-89b4-fcdcc8df0245,c_scale,fl_relative,w_1.0,h_1.0,fl_layer_apply/cf1cee8b-da14-42a6-8e4a-24bb45e72256/jordan-flight-essentials-85-washed-t-shirt-PdjT7C.png"
1720548837-138,https://www.nike.com/ca/men,Just Released,https://www.nike.com/ca/w/new-mens-3n82yznik1,Tops & T-Shirts,https://www.nike.com/ca/w/new-mens-tops-t-shirts-3n82yz9om13znik1,"<img alt=""Jordan Men&#x27;s T-Shirt"" class=""product-card__hero-image css-1fxh5tw"" height=""400"" loading=""lazy"" width=""400""/>",https://www.nike.com/ca/t/jordan-t-shirt-GkrSzw/FZ1936-410,Jordan,$60,"Rep one of the greatest in total comfort. Made from midweight cotton, this classic tee has a soft feel and a slight drape. That's what we call a winning combo.","https://static.nike.com/a/images/t_PDP_1728_v1/f_auto,q_auto:eco,u_126ab356-44d8-4a06-89b4-fcdcc8df0245,c_scale,fl_relative,w_1.0,h_1.0,fl_layer_apply/e32ec362-4759-4400-a6ae-cc5c1ef11e39/jordan-t-shirt-GkrSzw.png"
1720548839-139,https://www.nike.com/ca/men,Just Released,https://www.nike.com/ca/w/new-mens-3n82yznik1,Tops & T-Shirts,https://www.nike.com/ca/w/new-mens-tops-t-shirts-3n82yz9om13znik1,"<img alt=""Nike Sportswear Men&#x27;s Max90 T-Shirt"" class=""product-card__hero-image css-1fxh5tw"" height=""400"" loading=""lazy"" width=""400""/>",https://www.nike.com/ca/t/sportswear-max90-t-shirt-xjFBJS/FZ5392-370,Nike Sportswear,$64,"Dropped shoulders, longer sleeves and a roomy fit through the body and hips give this Max90 tee a relaxed and casual look. Midweight cotton fabric feels soft and has a slight drape.","https://static.nike.com/a/images/t_PDP_1728_v1/f_auto,q_auto:eco/6492fbd4-a48a-48f6-a355-98b869ba2a72/sportswear-max90-t-shirt-xjFBJS.png"
1720548840-139,https://www.nike.com/ca/men,Just Released,https://www.nike.com/ca/w/new-mens-3n82yznik1,Tops & T-Shirts,https://www.nike.com/ca/w/new-mens-tops-t-shirts-3n82yz9om13znik1,"<img alt=""Nike Sportswear Men&#x27;s Max90 T-Shirt"" class=""product-card__hero-image css-1fxh5tw"" height=""400"" loading=""lazy"" width=""400""/>",https://www.nike.com/ca/t/sportswear-max90-t-shirt-xjFBJS/FZ5392-370,Nike Sportswear,$64,"Dropped shoulders, longer sleeves and a roomy fit through the body and hips give this Max90 tee a relaxed and casual look. Midweight cotton fabric feels soft and has a slight drape.","https://static.nike.com/a/images/t_PDP_1728_v1/f_auto,q_auto:eco/6492fbd4-a48a-48f6-a355-98b869ba2a72/sportswear-max90-t-shirt-xjFBJS.png"
1720548842-140,https://www.nike.com/ca/men,Just Released,https://www.nike.com/ca/w/new-mens-3n82yznik1,Tops & T-Shirts,https://www.nike.com/ca/w/new-mens-tops-t-shirts-3n82yz9om13znik1,"<img alt=""Nike Sportswear Premium Essentials Men&#x27;s T-Shirt"" class=""product-card__hero-image css-1fxh5tw"" height=""400"" loading=""lazy"" width=""400""/>",https://www.nike.com/ca/t/sportswear-essentials-t-shirt-5zRBs6/DO7392-060,Nike Sportswear Premium Essentials,$55,"The Nike Sportswear Premium Essentials T-Shirt has a loose fit for a carefree, comfortable look. Its heavyweight organic cotton fabric feels thick and soft. This product is made from at least 75% organic cotton fibres.","https://static.nike.com/a/images/t_PDP_1728_v1/f_auto,q_auto:eco/4655101a-83df-48d4-ad6d-8dd231f76219/sportswear-essentials-t-shirt-5zRBs6.png"
1720548843-140,https://www.nike.com/ca/men,Just Released,https://www.nike.com/ca/w/new-mens-3n82yznik1,Tops & T-Shirts,https://www.nike.com/ca/w/new-mens-tops-t-shirts-3n82yz9om13znik1,"<img alt=""Nike Sportswear Premium Essentials Men&#x27;s T-Shirt"" class=""product-card__hero-image css-1fxh5tw"" height=""400"" loading=""lazy"" width=""400""/>",https://www.nike.com/ca/t/sportswear-essentials-t-shirt-5zRBs6/DO7392-060,Nike Sportswear Premium Essentials,$55,"The Nike Sportswear Premium Essentials T-Shirt has a loose fit for a carefree, comfortable look. Its heavyweight organic cotton fabric feels thick and soft. This product is made from at least 75% organic cotton fibres.","https://static.nike.com/a/images/t_PDP_1728_v1/f_auto,q_auto:eco/4655101a-83df-48d4-ad6d-8dd231f76219/sportswear-essentials-t-shirt-5zRBs6.png"
1720548845-141,https://www.nike.com/ca/men,Just Released,https://www.nike.com/ca/w/new-mens-3n82yznik1,Tops & T-Shirts,https://www.nike.com/ca/w/new-mens-tops-t-shirts-3n82yz9om13znik1,"<img alt=""Nike ACG &#x27;Northern Lights&#x27; Men&#x27;s Dri-FIT T-Shirt"" class=""product-card__hero-image css-1fxh5tw"" height=""400"" loading=""lazy"" width=""400""/>",https://www.nike.com/ca/t/acg-northern-lights-dri-fit-t-shirt-l1MNdP/FZ5279-010,Nike ACG 'Northern Lights',$68,"This heavyweight tee is inspired by the incredible colours of nature's best light show as seen from Fairbanks, Alaska. The ethereal graphics are paired with dropped shoulders, longer sleeves and a roomy fit through the body and hips for a relaxed look. Nike Dri-FIT technology moves sweat away from your skin for quicker evaporation, helping you stay dry and comfortable.","https://static.nike.com/a/images/t_PDP_1728_v1/f_auto,q_auto:eco/62c73064-4e0f-4821-99e8-473ce631c2c2/acg-northern-lights-dri-fit-t-shirt-l1MNdP.png"
1720548846-141,https://www.nike.com/ca/men,Just Released,https://www.nike.com/ca/w/new-mens-3n82yznik1,Tops & T-Shirts,https://www.nike.com/ca/w/new-mens-tops-t-shirts-3n82yz9om13znik1,"<img alt=""Nike ACG &#x27;Northern Lights&#x27; Men&#x27;s Dri-FIT T-Shirt"" class=""product-card__hero-image css-1fxh5tw"" height=""400"" loading=""lazy"" width=""400""/>",https://www.nike.com/ca/t/acg-northern-lights-dri-fit-t-shirt-l1MNdP/FZ5279-010,Nike ACG 'Northern Lights',$68,"This heavyweight tee is inspired by the incredible colours of nature's best light show as seen from Fairbanks, Alaska. The ethereal graphics are paired with dropped shoulders, longer sleeves and a roomy fit through the body and hips for a relaxed look. Nike Dri-FIT technology moves sweat away from your skin for quicker evaporation, helping you stay dry and comfortable.","https://static.nike.com/a/images/t_PDP_1728_v1/f_auto,q_auto:eco/62c73064-4e0f-4821-99e8-473ce631c2c2/acg-northern-lights-dri-fit-t-shirt-l1MNdP.png"
1720548847-142,https://www.nike.com/ca/men,Just Released,https://www.nike.com/ca/w/new-mens-3n82yznik1,Tops & T-Shirts,https://www.nike.com/ca/w/new-mens-tops-t-shirts-3n82yz9om13znik1,"<img alt=""Nike Sportswear Men&#x27;s Max90 T-Shirt"" class=""product-card__hero-image css-1fxh5tw"" height=""400"" loading=""lazy"" width=""400""/>",https://www.nike.com/ca/t/sportswear-max90-t-shirt-l8kv80/HF0001-100,Nike Sportswear,$55,"Dropped shoulders, longer sleeves and a roomy fit through the body and hips give this Max90 tee a relaxed and casual look. Lightweight cotton feels soft and comfortable all day.","https://static.nike.com/a/images/t_PDP_1728_v1/f_auto,q_auto:eco/ad17816a-1c51-44fe-93bd-837188283ae8/sportswear-max90-t-shirt-l8kv80.png"
1720548848-142,https://www.nike.com/ca/men,Just Released,https://www.nike.com/ca/w/new-mens-3n82yznik1,Tops & T-Shirts,https://www.nike.com/ca/w/new-mens-tops-t-shirts-3n82yz9om13znik1,"<img alt=""Nike Sportswear Men&#x27;s Max90 T-Shirt"" class=""product-card__hero-image css-1fxh5tw"" height=""400"" loading=""lazy"" width=""400""/>",https://www.nike.com/ca/t/sportswear-max90-t-shirt-l8kv80/HF0001-100,Nike Sportswear,$55,"Dropped shoulders, longer sleeves and a roomy fit through the body and hips give this Max90 tee a relaxed and casual look. Lightweight cotton feels soft and comfortable all day.","https://static.nike.com/a/images/t_PDP_1728_v1/f_auto,q_auto:eco/ad17816a-1c51-44fe-93bd-837188283ae8/sportswear-max90-t-shirt-l8kv80.png"
1720548850-143,https://www.nike.com/ca/men,Just Released,https://www.nike.com/ca/w/new-mens-3n82yznik1,Tops & T-Shirts,https://www.nike.com/ca/w/new-mens-tops-t-shirts-3n82yz9om13znik1,"<img alt=""Nike ACG Men&#x27;s Dri-FIT T-Shirt"" class=""product-card__hero-image css-1fxh5tw"" height=""400"" loading=""lazy"" width=""400""/>",https://www.nike.com/ca/t/acg-dri-fit-t-shirt-HXMV24/FZ5277-474,Nike ACG,$68,"When in Alaska, yield to the dog sleds! This roomy tee has dropped shoulders, longer sleeves and a roomy fit through the body and hips for a relaxed look. Heavyweight jersey fabric has a structured feel for an elevated finish. Nike Dri-FIT technology moves sweat away from your skin for quicker evaporation, helping you stay dry and comfortable.","https://static.nike.com/a/images/t_PDP_1728_v1/f_auto,q_auto:eco/19b86dd0-3d5a-4926-b398-88605bc61086/acg-dri-fit-t-shirt-HXMV24.png"
