web-scraper-order,web-scraper-start-url,category,category-href,sub-category,sub-category-href,product-link,product-link-href,name,price,description,img-src
1720549245-266,https://www.nike.com/ca/men,Clothing,https://www.nike.com/ca/w/mens-clothing-6ymx6znik1,Hoodies & Sweatshirts,https://www.nike.com/ca/w/mens-hoodies-sweatshirts-6riveznik1,"<img alt=""Nike Sportswear Club Men&#x27;s Pullover Hoodie"" class=""product-card__hero-image css-1fxh5tw"" height=""400"" loading=""lazy"" width=""400""/>",https://www.nike.com/ca/t/sportswear-club-pullover-hoodie-Q0g9rp/CZ7857-063,Nike Sportswear Club,$85,"A wardrobe staple, the Nike Sportswear Club Hoodie combines classic style with soft comfort.","https://static.nike.com/a/images/t_PDP_1728_v1/f_auto,q_auto:eco/50726fe6-c774-469a-9f27-40186e0c3318/sportswear-club-pullover-hoodie-Q0g9rp.png"
1720549246-266,https://www.nike.com/ca/men,Clothing,https://www.nike.com/ca/w/mens-clothing-6ymx6znik1,Hoodies & Sweatshirts,https://www.nike.com/ca/w/mens-hoodies-sweatshirts-6riveznik1,"<img alt=""Nike Sportswear Club Men&#x27;s Pullover Hoodie"" class=""product-card__hero-image css-1fxh5tw"" height=""400"" loading=""lazy"" width=""400""/>",https://www.nike.com/ca/t/sportswear-club-pullover-hoodie-Q0g9rp/CZ7857-063,Nike Sportswear Club,$85,"A wardrobe staple, the Nike Sportswear Club Hoodie combines classic style with soft comfort.","https://static.nike.com/a/images/t_PDP_1728_v1/f_auto,q_auto:eco/50726fe6-c774-469a-9f27-40186e0c3318/sportswear-club-pullover-hoodie-Q0g9rp.png"
1720549248-267,https://www.nike.com/ca/men,Clothing,https://www.nike.com/ca/w/mens-clothing-6ymx6znik1,Hoodies & Sweatshirts,https://www.nike.com/ca/w/mens-hoodies-sweatshirts-6riveznik1,"<img alt=""Nike Dry Men&#x27;s Dri-FIT Hooded Fitness Full-Zip Hoodie"" class=""product-card__hero-image css-1fxh5tw"" height=""400"" loading=""lazy"" width=""400""/>",https://www.nike.com/ca/t/dry-dri-fit-hooded-fitness-hoodie-2PfZ40/CZ6376-010,Nike Dry,$95,"The Nike Dry hoodie is made from soft French terry fabric with sweat-wicking power to help keep you warm and dry when you're warming up, cooling down or catching your breath between sets. This product is made from 100% sustainable materials, using a blend of both recycled polyester and organic cotton fibres. The blend is at least 10% recycled fibres or at least 10% organic cotton fibres.","https://static.nike.com/a/images/t_PDP_1728_v1/f_auto,q_auto:eco/6cd8c2b2-a87a-483d-be91-01dcb1d0704e/dry-dri-fit-hooded-fitness-hoodie-2PfZ40.png"
1720549250-268,https://www.nike.com/ca/men,Clothing,https://www.nike.com/ca/w/mens-clothing-6ymx6znik1,Hoodies & Sweatshirts,https://www.nike.com/ca/w/mens-hoodies-sweatshirts-6riveznik1,"<img alt=""Jordan Brooklyn Fleece Men&#x27;s Pullover Hoodie"" class=""product-card__hero-image css-1fxh5tw"" height=""400"" loading=""lazy"" width=""400""/>",https://www.nike.com/ca/t/jordan-brooklyn-fleece-pullover-hoodie-RZPJ7c/DQ7466-091,Jordan Brooklyn Fleece,$90,Rep your Jordan Brand pride while staying warm in this super-soft fleece hoodie. This wardrobe staple makes a subtle statement with an embroidered Jumpman logo on the chest.,"https://static.nike.com/a/images/t_PDP_1728_v1/f_auto,q_auto:eco,u_126ab356-44d8-4a06-89b4-fcdcc8df0245,c_scale,fl_relative,w_1.0,h_1.0,fl_layer_apply/17245fa0-53f7-4e1a-bcea-39e3210a65c6/jordan-brooklyn-fleece-pullover-hoodie-RZPJ7c.png"
1720549253-269,https://www.nike.com/ca/men,Clothing,https://www.nike.com/ca/w/mens-clothing-6ymx6znik1,Hoodies & Sweatshirts,https://www.nike.com/ca/w/mens-hoodies-sweatshirts-6riveznik1,"<img alt=""Nike Sportswear Men&#x27;s Fleece Pullover Hoodie"" class=""product-card__hero-image css-1fxh5tw"" height=""400"" loading=""lazy"" width=""400""/>",https://www.nike.com/ca/t/sportswear-fleece-pullover-hoodie-jd8W6D/FZ0201-416,Nike Sportswear,$100,"An easy fit and a cotton-lined hood add extra comfort to this street-ready layer. Made from midweight brushed fleece that feels extra soft on the inside and smooth on the outside, this hoodie helps you stay cosy while keeping its structured shape.","https://static.nike.com/a/images/t_PDP_1728_v1/f_auto,q_auto:eco/ccf8818d-93bb-43d1-bbc2-b591e9c785ac/sportswear-fleece-pullover-hoodie-jd8W6D.png"
1720549254-269,https://www.nike.com/ca/men,Clothing,https://www.nike.com/ca/w/mens-clothing-6ymx6znik1,Hoodies & Sweatshirts,https://www.nike.com/ca/w/mens-hoodies-sweatshirts-6riveznik1,"<img alt=""Nike Sportswear Men&#x27;s Fleece Pullover Hoodie"" class=""product-card__hero-image css-1fxh5tw"" height=""400"" loading=""lazy"" width=""400""/>",https://www.nike.com/ca/t/sportswear-fleece-pullover-hoodie-jd8W6D/FZ0201-416,Nike Sportswear,$100,"An easy fit and a cotton-lined hood add extra comfort to this street-ready layer. Made from midweight brushed fleece that feels extra soft on the inside and smooth on the outside, this hoodie helps you stay cosy while keeping its structured shape.","https://static.nike.com/a/images/t_PDP_1728_v1/f_auto,q_auto:eco/ccf8818d-93bb-43d1-bbc2-b591e9c785ac/sportswear-fleece-pullover-hoodie-jd8W6D.png"
1720549256-270,https://www.nike.com/ca/men,Clothing,https://www.nike.com/ca/w/mens-clothing-6ymx6znik1,Hoodies & Sweatshirts,https://www.nike.com/ca/w/mens-hoodies-sweatshirts-6riveznik1,"<img alt=""Jordan Brooklyn Fleece Men&#x27;s Printed Pullover Hoodie"" class=""product-card__hero-image css-1fxh5tw"" height=""400"" loading=""lazy"" width=""400""/>",https://www.nike.com/ca/t/jordan-brooklyn-fleece-printed-pullover-hoodie-K3SZDv/FJ7774-604,Jordan Brooklyn Fleece,$85,"You want a hoodie that's simple and looks good, right? Here you go. It's made from soft fleece that's smooth on the outside and plush on the inside, helping you stay comfy and warm all day.","https://static.nike.com/a/images/t_PDP_1728_v1/f_auto,q_auto:eco,u_126ab356-44d8-4a06-89b4-fcdcc8df0245,c_scale,fl_relative,w_1.0,h_1.0,fl_layer_apply/4e0fd577-98c4-48a2-980d-a14241257014/jordan-brooklyn-fleece-printed-pullover-hoodie-K3SZDv.png"
1720549259-271,https://www.nike.com/ca/men,Clothing,https://www.nike.com/ca/w/mens-clothing-6ymx6znik1,Hoodies & Sweatshirts,https://www.nike.com/ca/w/mens-hoodies-sweatshirts-6riveznik1,"<img alt=""Nike Therma Men&#x27;s Therma-FIT Full-Zip Fitness Top"" class=""product-card__hero-image css-1fxh5tw"" height=""400"" loading=""lazy"" width=""400""/>",https://www.nike.com/ca/t/therma-fitness-top-QbMW7g/DQ4830-010,Nike Therma,$85,Bring the heat to your cold-weather workout with the Therma Top. Super-soft fleece keeps the comfort levels high while you take your exercise routine to the next level. A relaxed feel means you can stretch and bench without anything holding you back.,"https://static.nike.com/a/images/t_PDP_1728_v1/f_auto,q_auto:eco/c013660a-93fe-48eb-bd2f-ca731d344905/therma-fitness-top-QbMW7g.png"
1720549260-271,https://www.nike.com/ca/men,Clothing,https://www.nike.com/ca/w/mens-clothing-6ymx6znik1,Hoodies & Sweatshirts,https://www.nike.com/ca/w/mens-hoodies-sweatshirts-6riveznik1,"<img alt=""Nike Therma Men&#x27;s Therma-FIT Full-Zip Fitness Top"" class=""product-card__hero-image css-1fxh5tw"" height=""400"" loading=""lazy"" width=""400""/>",https://www.nike.com/ca/t/therma-fitness-top-QbMW7g/DQ4830-010,Nike Therma,$85,Bring the heat to your cold-weather workout with the Therma Top. Super-soft fleece keeps the comfort levels high while you take your exercise routine to the next level. A relaxed feel means you can stretch and bench without anything holding you back.,"https://static.nike.com/a/images/t_PDP_1728_v1/f_auto,q_auto:eco/c013660a-93fe-48eb-bd2f-ca731d344905/therma-fitness-top-QbMW7g.png"
1720549263-272,https://www.nike.com/ca/men,Clothing,https://www.nike.com/ca/w/mens-clothing-6ymx6znik1,Hoodies & Sweatshirts,https://www.nike.com/ca/w/mens-hoodies-sweatshirts-6riveznik1,"<img alt=""Nike Sportswear Club Fleece Men&#x27;s Full-Zip Hoodie"" class=""product-card__hero-image css-1fxh5tw"" height=""400"" loading=""lazy"" width=""400""/>",https://www.nike.com/ca/t/sportswear-club-fleece-hoodie-qzVJfR/BV2645-010,Nike Sportswear Club Fleece,$85,"The Nike Sportswear Club Fleece Hoodie combines soft fabric with simple street style that's versatile enough for everyday use. With a full zip that goes to the chin, it's the perfect extra layer on a chilly day.","https://static.nike.com/a/images/t_PDP_1728_v1/f_auto,q_auto:eco/0429c66f-3314-4df0-97e9-a8bb33c065fa/sportswear-club-fleece-hoodie-qzVJfR.png"
1720549266-273,https://www.nike.com/ca/men,Clothing,https://www.nike.com/ca/w/mens-clothing-6ymx6znik1,Hoodies & Sweatshirts,https://www.nike.com/ca/w/mens-hoodies-sweatshirts-6riveznik1,"<img alt=""Nike Solo Swoosh Men&#x27;s Fleece Crew"" class=""product-card__hero-image css-1fxh5tw"" height=""400"" loading=""lazy"" width=""400""/>",https://www.nike.com/ca/t/solo-swoosh-fleece-crew-TKDGzc/DX1361-010,Nike Solo Swoosh,$110,"Celebrate the power and simplicity of the Swoosh. This warm fleece crew is made with some extra room through the shoulders, chest and body for easy comfort and laid-back, nostalgic style. Stretchy ribbed openings help hold the crew in place when you move and seal in your body heat when the weather cools.","https://static.nike.com/a/images/t_PDP_1728_v1/f_auto,q_auto:eco/fc1e5d2d-1c26-4d77-851c-bd8e889fa25d/solo-swoosh-fleece-crew-TKDGzc.png"
1720549268-274,https://www.nike.com/ca/men,Clothing,https://www.nike.com/ca/w/mens-clothing-6ymx6znik1,Hoodies & Sweatshirts,https://www.nike.com/ca/w/mens-hoodies-sweatshirts-6riveznik1,"<img alt=""Nike Solo Swoosh Men&#x27;s Fleece Pullover Hoodie"" class=""product-card__hero-image css-1fxh5tw"" height=""400"" loading=""lazy"" width=""400""/>",https://www.nike.com/ca/t/solo-swoosh-fleece-pullover-hoodie-Tdnb6B/DX1355-051,Nike Solo Swoosh,$120,"Celebrate the power and simplicity of the Swoosh. This warm, brushed-fleece hoodie is made with some extra room through the shoulders, chest and body for easy comfort and laid-back, nostalgic style. Thick, stretchy ribbing on the cuffs and hem help hold the hoodie in place when you move and seal in your warmth when conditions cool. Our solo Swoosh is embroidered on the left chest to keep your look clean and effortless.","https://static.nike.com/a/images/t_PDP_1728_v1/f_auto,q_auto:eco/07f2f472-574d-47d4-83cd-4661aa33eeab/solo-swoosh-fleece-pullover-hoodie-Tdnb6B.png"
1720549269-274,https://www.nike.com/ca/men,Clothing,https://www.nike.com/ca/w/mens-clothing-6ymx6znik1,Hoodies & Sweatshirts,https://www.nike.com/ca/w/mens-hoodies-sweatshirts-6riveznik1,"<img alt=""Nike Solo Swoosh Men&#x27;s Fleece Pullover Hoodie"" class=""product-card__hero-image css-1fxh5tw"" height=""400"" loading=""lazy"" width=""400""/>",https://www.nike.com/ca/t/solo-swoosh-fleece-pullover-hoodie-Tdnb6B/DX1355-051,Nike Solo Swoosh,$120,"Celebrate the power and simplicity of the Swoosh. This warm, brushed-fleece hoodie is made with some extra room through the shoulders, chest and body for easy comfort and laid-back, nostalgic style. Thick, stretchy ribbing on the cuffs and hem help hold the hoodie in place when you move and seal in your warmth when conditions cool. Our solo Swoosh is embroidered on the left chest to keep your look clean and effortless.","https://static.nike.com/a/images/t_PDP_1728_v1/f_auto,q_auto:eco/07f2f472-574d-47d4-83cd-4661aa33eeab/solo-swoosh-fleece-pullover-hoodie-Tdnb6B.png"
1720549271-275,https://www.nike.com/ca/men,Clothing,https://www.nike.com/ca/w/mens-clothing-6ymx6znik1,Hoodies & Sweatshirts,https://www.nike.com/ca/w/mens-hoodies-sweatshirts-6riveznik1,"<img alt=""Nike Sportswear Tech Fleece Windrunner Men&#x27;s Full-Zip Hoodie"" class=""product-card__hero-image css-1fxh5tw"" height=""400"" loading=""lazy"" width=""400""/>",https://www.nike.com/ca/t/sportswear-tech-fleece-windrunner-hoodie-XGC5Gr/FB7921-063,,,,
1720549276-276,https://www.nike.com/ca/men,Clothing,https://www.nike.com/ca/w/mens-clothing-6ymx6znik1,Tops & T-Shirts,https://www.nike.com/ca/w/mens-tops-t-shirts-9om13znik1,"<img alt=""Nike Men&#x27;s Max90 Basketball T-Shirt"" class=""product-card__hero-image css-1fxh5tw"" height=""400"" loading=""lazy"" width=""400""/>",https://www.nike.com/ca/t/max90-basketball-t-shirt-vr7KTP/FZ8093-010,Nike,$55,"This Max90 tee is designed with dropped shoulders, longer sleeves and a roomy fit through the body. Its soft, midweight cotton fabric feels soft and slightly textured.","https://static.nike.com/a/images/t_PDP_1728_v1/f_auto,q_auto:eco/e9ed6b46-441b-4131-ac73-e8d5f9370911/max90-basketball-t-shirt-vr7KTP.png"
1720549279-277,https://www.nike.com/ca/men,Clothing,https://www.nike.com/ca/w/mens-clothing-6ymx6znik1,Tops & T-Shirts,https://www.nike.com/ca/w/mens-tops-t-shirts-9om13znik1,"<img alt=""Nike Rise 365 Men&#x27;s Dri-FIT Short-Sleeve Running Top"" class=""product-card__hero-image css-1fxh5tw"" height=""400"" loading=""lazy"" width=""400""/>",https://www.nike.com/ca/t/rise-365-dri-fit-short-sleeve-running-top-bHZcg9/CZ9184-013,Nike Rise 365,$68,"A lightweight favourite returns with more breathability. The Nike 365 Top is made with runner-informed data for cooling in areas where you need it. It has the same soft feel you've come to expect, with design details that nod to the iconic Nike chevron. This product is made from 100% recycled polyester fibres.","https://static.nike.com/a/images/t_PDP_1728_v1/f_auto,q_auto:eco/320f9241-688e-46e5-b721-81e3858e66d4/rise-365-dri-fit-short-sleeve-running-top-bHZcg9.png"
1720549280-277,https://www.nike.com/ca/men,Clothing,https://www.nike.com/ca/w/mens-clothing-6ymx6znik1,Tops & T-Shirts,https://www.nike.com/ca/w/mens-tops-t-shirts-9om13znik1,"<img alt=""Nike Rise 365 Men&#x27;s Dri-FIT Short-Sleeve Running Top"" class=""product-card__hero-image css-1fxh5tw"" height=""400"" loading=""lazy"" width=""400""/>",https://www.nike.com/ca/t/rise-365-dri-fit-short-sleeve-running-top-bHZcg9/CZ9184-013,Nike Rise 365,$68,"A lightweight favourite returns with more breathability. The Nike 365 Top is made with runner-informed data for cooling in areas where you need it. It has the same soft feel you've come to expect, with design details that nod to the iconic Nike chevron. This product is made from 100% recycled polyester fibres.","https://static.nike.com/a/images/t_PDP_1728_v1/f_auto,q_auto:eco/320f9241-688e-46e5-b721-81e3858e66d4/rise-365-dri-fit-short-sleeve-running-top-bHZcg9.png"
1720549282-278,https://www.nike.com/ca/men,Clothing,https://www.nike.com/ca/w/mens-clothing-6ymx6znik1,Tops & T-Shirts,https://www.nike.com/ca/w/mens-tops-t-shirts-9om13znik1,"<img alt=""Nike Sportswear Men&#x27;s Polo"" class=""product-card__hero-image css-1fxh5tw"" height=""400"" loading=""lazy"" width=""400""/>",https://www.nike.com/ca/t/sportswear-polo-rjskc0/CJ4456-010,Nike Sportswear,$55,"The Nike Sportswear Polo elevates a timeless style with refined details. Crafted from ultra-soft cotton, it features a fold-over collar with a 2-button placket for a classic look with a modern edge.","https://static.nike.com/a/images/t_PDP_1728_v1/f_auto,q_auto:eco/66ff7ae4-4fab-453c-81cd-e2984b369cda/sportswear-polo-rjskc0.png"
1720549284-279,https://www.nike.com/ca/men,Clothing,https://www.nike.com/ca/w/mens-clothing-6ymx6znik1,Tops & T-Shirts,https://www.nike.com/ca/w/mens-tops-t-shirts-9om13znik1,"<img alt=""Nike ACG Men&#x27;s Dri-FIT T-Shirt"" class=""product-card__hero-image css-1fxh5tw"" height=""400"" loading=""lazy"" width=""400""/>",https://www.nike.com/ca/t/acg-dri-fit-t-shirt-fd4ZBF/FZ5275-010,Nike ACG,$68,"This tee brings the glowing glaciers and breathtaking starry skies of Fairbanks, Alaska to you. It has dropped shoulders, longer sleeves and a roomy fit through the body and hips for a relaxed look. Heavyweight cotton feels structured for an elevated finish.","https://static.nike.com/a/images/t_PDP_1728_v1/f_auto,q_auto:eco/3e6abf6e-2a05-4b98-ad39-6afb1ce29fc6/acg-dri-fit-t-shirt-fd4ZBF.png"
1720549285-279,https://www.nike.com/ca/men,Clothing,https://www.nike.com/ca/w/mens-clothing-6ymx6znik1,Tops & T-Shirts,https://www.nike.com/ca/w/mens-tops-t-shirts-9om13znik1,"<img alt=""Nike ACG Men&#x27;s Dri-FIT T-Shirt"" class=""product-card__hero-image css-1fxh5tw"" height=""400"" loading=""lazy"" width=""400""/>",https://www.nike.com/ca/t/acg-dri-fit-t-shirt-fd4ZBF/FZ5275-010,Nike ACG,$68,"This tee brings the glowing glaciers and breathtaking starry skies of Fairbanks, Alaska to you. It has dropped shoulders, longer sleeves and a roomy fit through the body and hips for a relaxed look. Heavyweight cotton feels structured for an elevated finish.","https://static.nike.com/a/images/t_PDP_1728_v1/f_auto,q_auto:eco/3e6abf6e-2a05-4b98-ad39-6afb1ce29fc6/acg-dri-fit-t-shirt-fd4ZBF.png"
1720549287-280,https://www.nike.com/ca/men,Clothing,https://www.nike.com/ca/w/mens-clothing-6ymx6znik1,Tops & T-Shirts,https://www.nike.com/ca/w/mens-tops-t-shirts-9om13znik1,"<img alt=""Liverpool F.C. 2024/25 Stadium Home Men&#x27;s Nike Dri-FIT Football Replica Shirt"" class=""product-card__hero-image css-1fxh5tw"" height=""400"" loading=""lazy"" width=""400""/>",https://www.nike.com/ca/t/liverpool-fc-2024-25-stadium-home-dri-fit-football-replica-shirt-dmlTgM/FN8798-688,Liverpool F.C. 2024/25 Stadium Home,$115,Our Stadium collection pairs replica design details with sweat-wicking technology to give you a game-ready look inspired by your favourite team.,"https://static.nike.com/a/images/t_PDP_1728_v1/f_auto,q_auto:eco/b4e36fa3-7a09-463d-ba35-0aff51968a97/liverpool-fc-2024-25-stadium-home-dri-fit-football-replica-shirt-dmlTgM.png"
1720549291-281,https://www.nike.com/ca/men,Clothing,https://www.nike.com/ca/w/mens-clothing-6ymx6znik1,Tops & T-Shirts,https://www.nike.com/ca/w/mens-tops-t-shirts-9om13znik1,"<img alt=""Nike ACG Men&#x27;s T-Shirt"" class=""product-card__hero-image css-1fxh5tw"" height=""400"" loading=""lazy"" width=""400""/>",https://www.nike.com/ca/t/acg-t-shirt-m5xKGg/DQ1815-011,Nike ACG,$55,"Breathe in that fresh air with this spacious, soft tee. It feels like a classic, with a slightly baggy fit. And when you're out enjoying the great outdoors, the lung-shaped graphic reminds you to stop, breathe and take in the scenery. This product is made from 100% sustainable materials, using a blend of both recycled polyester and organic cotton fibres. The blend is at least 10% recycled fibres or at least 10% organic cotton fibres.","https://static.nike.com/a/images/t_PDP_1728_v1/f_auto,q_auto:eco/e867d450-8244-4141-b85d-abb3584501d5/acg-t-shirt-m5xKGg.png"
1720549293-282,https://www.nike.com/ca/men,Clothing,https://www.nike.com/ca/w/mens-clothing-6ymx6znik1,Tops & T-Shirts,https://www.nike.com/ca/w/mens-tops-t-shirts-9om13znik1,"<img alt=""Jordan Flight Essentials Men&#x27;s T-Shirt"" class=""product-card__hero-image css-1fxh5tw"" height=""400"" loading=""lazy"" width=""400""/>",https://www.nike.com/ca/t/jordan-flight-essentials-t-shirt-zHC3JD/FN6000-010,Jordan Flight Essentials,$50,Jordan's game on the court was a work of art. Pay tribute to his undeniable style and talent with a soft cotton tee inspired by pointillism paintings.,"https://static.nike.com/a/images/t_PDP_1728_v1/f_auto,q_auto:eco,u_126ab356-44d8-4a06-89b4-fcdcc8df0245,c_scale,fl_relative,w_1.0,h_1.0,fl_layer_apply/e1e7a079-a903-4617-b711-55375d9ead78/jordan-flight-essentials-t-shirt-zHC3JD.png"
1720549294-282,https://www.nike.com/ca/men,Clothing,https://www.nike.com/ca/w/mens-clothing-6ymx6znik1,Tops & T-Shirts,https://www.nike.com/ca/w/mens-tops-t-shirts-9om13znik1,"<img alt=""Jordan Flight Essentials Men&#x27;s T-Shirt"" class=""product-card__hero-image css-1fxh5tw"" height=""400"" loading=""lazy"" width=""400""/>",https://www.nike.com/ca/t/jordan-flight-essentials-t-shirt-zHC3JD/FN6000-010,Jordan Flight Essentials,$50,Jordan's game on the court was a work of art. Pay tribute to his undeniable style and talent with a soft cotton tee inspired by pointillism paintings.,"https://static.nike.com/a/images/t_PDP_1728_v1/f_auto,q_auto:eco,u_126ab356-44d8-4a06-89b4-fcdcc8df0245,c_scale,fl_relative,w_1.0,h_1.0,fl_layer_apply/e1e7a079-a903-4617-b711-55375d9ead78/jordan-flight-essentials-t-shirt-zHC3JD.png"
1720549296-283,https://www.nike.com/ca/men,Clothing,https://www.nike.com/ca/w/mens-clothing-6ymx6znik1,Tops & T-Shirts,https://www.nike.com/ca/w/mens-tops-t-shirts-9om13znik1,"<img alt=""Jordan Air Men&#x27;s Stretch T-Shirt"" class=""product-card__hero-image css-1fxh5tw"" height=""400"" loading=""lazy"" width=""400""/>",https://www.nike.com/ca/t/jordan-air-stretch-t-shirt-dXT13F/DV1445-687,Jordan Air,$50,"Show off your MJ pride with an extra-large print that covers your full wingspan, sleeve to sleeve. Printed on stretchy cotton, this is your new bold and comfortable go-to.","https://static.nike.com/a/images/t_PDP_1728_v1/f_auto,q_auto:eco,u_126ab356-44d8-4a06-89b4-fcdcc8df0245,c_scale,fl_relative,w_1.0,h_1.0,fl_layer_apply/ca804c11-42d6-4054-9389-6bc32da96871/jordan-air-stretch-t-shirt-dXT13F.png"
1720549299-284,https://www.nike.com/ca/men,Clothing,https://www.nike.com/ca/w/mens-clothing-6ymx6znik1,Tops & T-Shirts,https://www.nike.com/ca/w/mens-tops-t-shirts-9om13znik1,"<img alt=""Los Angeles Lakers 2023/24 City Edition Men&#x27;s Nike NBA Courtside Max90 T-Shirt"" class=""product-card__hero-image css-1fxh5tw"" height=""400"" loading=""lazy"" width=""400""/>",https://www.nike.com/ca/t/los-angeles-lakers-2023-24-city-edition-nba-courtside-max90-t-shirt-ZCgwxP/FN2006-010,Los Angeles Lakers 2023/24 City Edition,$55,"Our City Edition Collection celebrates the bond between a team and the town they call home. Inspired by iconic city symbols and past Los Angeles Lakers kits, this tee highlights the unique cultures, communities and history that set LA apart. Dropped shoulders, longer sleeves and a roomy fit through the body and hips give the Max90 tee a relaxed and casual look.","https://static.nike.com/a/images/t_PDP_1728_v1/f_auto,q_auto:eco/80fa5a4e-4c8e-4d6d-83c5-e5eefabfe5ef/los-angeles-lakers-2023-24-city-edition-nba-courtside-max90-t-shirt-ZCgwxP.png"
1720549302-285,https://www.nike.com/ca/men,Clothing,https://www.nike.com/ca/w/mens-clothing-6ymx6znik1,Tops & T-Shirts,https://www.nike.com/ca/w/mens-tops-t-shirts-9om13znik1,"<img alt=""Jordan Brand Men&#x27;s T-Shirt"" class=""product-card__hero-image css-1fxh5tw"" height=""400"" loading=""lazy"" width=""400""/>",https://www.nike.com/ca/t/jordan-brand-t-shirt-w8nBhL/FN5982-010,Jordan Brand,$65,"The only thing that could make a classic tee better? A classic sneaker. Made from 100% cotton, this relaxed tee features a small embroidered AJ1 patch for a subtle hit of cool.","https://static.nike.com/a/images/t_PDP_1728_v1/f_auto,q_auto:eco,u_126ab356-44d8-4a06-89b4-fcdcc8df0245,c_scale,fl_relative,w_1.0,h_1.0,fl_layer_apply/ba35ccbd-3185-469f-9665-0ac07f31d647/jordan-brand-t-shirt-w8nBhL.png"
1720549305-286,https://www.nike.com/ca/men,Clothing,https://www.nike.com/ca/w/mens-clothing-6ymx6znik1,Tops & T-Shirts,https://www.nike.com/ca/w/mens-tops-t-shirts-9om13znik1,"<img alt=""Jordan Flight Essentials Men&#x27;s T-Shirt"" class=""product-card__hero-image css-1fxh5tw"" height=""400"" loading=""lazy"" width=""400""/>",https://www.nike.com/ca/t/jordan-flight-essentials-t-shirt-w7Wrq8/FZ1967-100,Jordan Flight Essentials,$50,"Let 'em know you're skyborne. Midweight cotton gives this classic tee a soft feel and slight drape, making it ideal for everyday wear.","https://static.nike.com/a/images/t_PDP_1728_v1/f_auto,q_auto:eco,u_126ab356-44d8-4a06-89b4-fcdcc8df0245,c_scale,fl_relative,w_1.0,h_1.0,fl_layer_apply/2bb60b5c-6f01-42d1-ae2c-b21ea1ff3c7b/jordan-flight-essentials-t-shirt-w7Wrq8.png"
1720549309-287,https://www.nike.com/ca/men,Clothing,https://www.nike.com/ca/w/mens-clothing-6ymx6znik1,Tops & T-Shirts,https://www.nike.com/ca/w/mens-tops-t-shirts-9om13znik1,"<img alt=""Kevin Durant Men&#x27;s Basketball T-shirt"" class=""product-card__hero-image css-1fxh5tw"" height=""400"" loading=""lazy"" width=""400""/>",https://www.nike.com/ca/t/kevin-durant-basketball-t-shirt-BjWVb7/FV8404-493,Kevin Durant,$64,Our KD signature apparel collection celebrates the next generation of do-it-all athletes with pieces you can wear anywhere. This relaxed-fit tee is made from soft midweight cotton. The graphics feature the official stamp of approval from Easy Money.,"https://static.nike.com/a/images/t_PDP_1728_v1/f_auto,q_auto:eco/a7af3372-2e32-45b4-937b-f4e839ea3ae2/kevin-durant-basketball-t-shirt-BjWVb7.png"
1720549311-288,https://www.nike.com/ca/men,Clothing,https://www.nike.com/ca/w/mens-clothing-6ymx6znik1,Tops & T-Shirts,https://www.nike.com/ca/w/mens-tops-t-shirts-9om13znik1,"<img alt=""Nike Max90 Men&#x27;s Basketball T-shirt"" class=""product-card__hero-image css-1fxh5tw"" height=""400"" loading=""lazy"" width=""400""/>",https://www.nike.com/ca/t/max90-basketball-t-shirt-szR3HB/FZ8081-010,Nike Max90,$55,"Ignite the court with this Max90 tee, designed with a loose fit and soft midweight cotton.","https://static.nike.com/a/images/t_PDP_1728_v1/f_auto,q_auto:eco/aa11a2ab-b1dd-4ab9-88e2-5673ea887be6/max90-basketball-t-shirt-szR3HB.png"
1720549312-288,https://www.nike.com/ca/men,Clothing,https://www.nike.com/ca/w/mens-clothing-6ymx6znik1,Tops & T-Shirts,https://www.nike.com/ca/w/mens-tops-t-shirts-9om13znik1,"<img alt=""Nike Max90 Men&#x27;s Basketball T-shirt"" class=""product-card__hero-image css-1fxh5tw"" height=""400"" loading=""lazy"" width=""400""/>",https://www.nike.com/ca/t/max90-basketball-t-shirt-szR3HB/FZ8081-010,Nike Max90,$55,"Ignite the court with this Max90 tee, designed with a loose fit and soft midweight cotton.","https://static.nike.com/a/images/t_PDP_1728_v1/f_auto,q_auto:eco/aa11a2ab-b1dd-4ab9-88e2-5673ea887be6/max90-basketball-t-shirt-szR3HB.png"
